What can I do when the Child support dept. that is supposed to be collecting my support is not doing their job & staying on top of it & I am giving them all the Information & they are not following through?, complaints
I need an email address, contact human
I need the number to check on all my cases., contact human
Please have supervisor call me, contact human
May I have the customer service number, contact human
What is there phone number, contact human
Getting in touch with my case worker, contact human
I’m tryna get the contact number, contact human
Customer service, contact human
What is the wed site to put on yur phone, contact human
Yes I’m looking for a customer service phone number, contact human
Can I speak with a real person?, contact human
I am a child on the case but I am 21 won’t nobody talk to me why, contact human
Phone number to check case status, contact human
I need to speak to someone. Do you have a direct phone number?, contact human
Can I talk to someone they been cutting the absent parent check and I need to find out about how to receive them payments, contact human
speak to a person, contact human
what is customer service, contact human
Phone, contact human
who do i get in touch with to figure out what’s taking so long for my case, contact human
DIGITS N. Gloster Street Suite B Tupelo MS ZIPCODE; I tried callin the number listed online PHONE_NUMBER. I received a message that the number was not in service., contact human
number to check my address on file is correct, contact human
1 800 number so I can check on my cases, contact human
Speak with someone, contact human
I need to set this up asap please PHONE_NUMBER, contact human
Phone number phone num, contact human
Call them, contact human
Legal services number, contact human
No one will answer this number, contact human
When you find out let me know so I can send check., contact human
Can I speak to an agent?, contact human
Customer services, contact human
Can you please call me, contact human
Speak to someone, contact human
How fast because I'm using others device at the moment I need you to call me before 4:30 if so PHONE_NUMBER, contact human
yes what number do i call to cancel a child support case, contact human
Speak to a agent, contact human
dont worry about it i'll call when i get off, contact human
Can i speak to a customer service rep, contact human
i need to talk to somebody right now, contact human
What's the DIGITS number to child support, contact human
I want to talk to a real person, contact human
Number to talk to worker, contact human
What is a number I can call to talk to someone, contact human
PHONE NUMBER, contact human
I received a letter with a case #. I need to know who to speak to via voice? Do you have a phone number, contact human
Whats the number to check your post date of your funds in ms, contact human
number to call, contact human
What is the best way to stay up to date and/or communicate with my case worker when I have concerns/questions?, contact human
Speak to a representative, contact human
How do I get I touch with dhs, contact human
phone numberr, contact human
local number, contact human
customer service, contact human
the phone number, contact human
Who else can be contacted, contact human
customer service rep, contact human
PHONE_NUMBER, contact human
Need to talk to caseworker about my pay ment, contact human
What’s the number, contact human
contact number, contact human
Coahoma county child support number from online sources is not correct., contact human
I don't want my local office. It's in pascagoula. I need a supervisor, contact human
I'm at the child support officr in Indiana and they need to speak with a customer service rep, contact human
Do you have the number, contact human
What's the number to the one in county line road, contact human
how long to hear from email?, contact human
Phone number, contact human
What is the number to call to find out if a payment had been made, contact human
Who can I call, contact human
Whats the number to call you all, contact human
U guys sent me a letter was trying to get a understanding, contact human
Trying to see how to contact child support to receive unpaid payments, contact human
I need the phone number for the legal department of child support, contact human
Number, contact human
they never anser, contact human
What's the DIGITS number where I can talk to someone, contact human
I NEED THE PHONE NUMBER, contact human
What’s the DIGITS number, contact human
I need to speak with manager, contact human
1-800 number, contact human
Child support phone number, contact human
Can  I get the 1 877 number, contact human
Could you have someone call me on PHONE_NUMBER, contact human
The local phone number, contact human
Customer service number, contact human
I was looking for a direct line to the Pascagoula office located on STREET_ADDRESS, contact human
yes im trying to see the number for tunica county child support office since its been move, contact human
what is the contact information to call someone in regards to this matter?, contact human
How can I speak to a respresentive, contact human
I need to speak with someone about that, contact human
Customer service number for ms, contact human
Phone number for vicksburg, contact human
What number do I call to check on the status of my case, contact human
Just need the DIGITS customer service number, contact human
I need to know what number do I call to c if any payments have been made, contact human
Contact info, contact human
the phone to correct the issue., contact human
I need to talk to someone about my case, contact human
I'm trying to talk to a worker, contact human
Speak with a representative, contact human
I need a phone number for child support in ms, contact human
phone number for Pascagoula, contact human
I’m trying to help my son to fine out how much child support he owe and I cannot get anyone to talk to me can you please help me, contact human
Can I have the child support hotline direct number?, contact human
who can I directly speak to about my case?, contact human
Contact, contact human
Why can't I just talk to a human, contact human
What number do I call if I have questions about child support papers I have filed?, contact human
Need to speak with someone, contact human
need to speak to representative, contact human
What’s da nunber, contact human
What’s the number to check., contact human
will they answer?, contact human
I need to talk to someone due to child support, contact human
What is their number, contact human
What's the child support phone number, contact human
Talk to someone, contact human
Representative, contact human
What is the phone number?, contact human
Can I get a phone number for this address?, contact human
What's the number where I can talk to a representative, contact human
What’s the direct number, contact human
Get a number, contact human
Please have a supervisor call me. Every person that has called me back has hung up because they are not trained to answer my question, contact human
Customer Service number, contact human
I want to talk to a agent, contact human
I need Mrs lay number she at county Drive, contact human
How do I talk with a real person?, contact human
Question submitted and no one called, contact human
Customer service number?, contact human
What is the number, contact human
Can I speak with someone, contact human
Do you have an automated phone payment line, contact human
I HAVE I DID NOT GET A COMPLETE ANSWER FORM THEM, contact human
is there a phone # i can call in PERSON_NAME ms to talk with someone about our case ?, contact human
phone number, contact human
What is the number to call for the automated system to check what I am currently owed?, contact human
im gonna call, contact human
Can I speak to a representative, contact human
Real person, contact human
I need the number from STREET_ADDRESS corinth ms, contact human
Is on file and every time I call them no one helps me no one, contact human
representative, contact human
Need to talk to someone about a continuance on court date asap, contact human