My husband works he gets paid bi weekly DIGITS a month, estimate payments
What is the state minimum per child?, estimate payments
can you tell me the percentage of income for 2 children child support is?, estimate payments
If the father receive ssi can the child still get support, estimate payments
How much is the minimum child support per month for one child in PERSON_NAME county MS, estimate payments
i'm trying to see how much i will owe, estimate payments
How much is 3 kids, estimate payments
Percentage of income paid by non-custodial parent., estimate payments
Do I get 20 percent  with 2 kids, estimate payments
How much does someone making $49000 a year pay in child support?, estimate payments
Determining income, estimate payments
I want to find how much I'm supposed to receive every month, estimate payments
I have to children and my net pay is DIGITS every two weeks how much support would I have to pay, estimate payments
I dont know how much my child father make, estimate payments
i wanna know what i will owe, estimate payments
what are the withholding limits, estimate payments
My payments are based on how much I make and hours I work correct?, estimate payments
how much am i going to need to pay for 2 kids, estimate payments
does the child support go by the amount the father makes and how many kids he has, estimate payments
How much am I getting, estimate payments
I need see how much children soupprot be get every month, estimate payments
percentage, estimate payments
calculator did not work, estimate payments
what will i owe for 3 kids, estimate payments
What is the minimum amount of child support and percentage of income required by the non/custodial parent?, estimate payments
If the child's father does not work what is the amount he would have to pay?, estimate payments
I have two children. One who is under my care one who isn’t. The mother of my son which is the child I’m having to pay child support is requesting I pay 14% wouldn’t it be cheaper since I have another child, estimate payments
What is the percentage of child support for 2 children, estimate payments
percentage of income, estimate payments
two children by two different mothers. What percent would I be obligated to pay?, estimate payments