PHONE_NUMBER IS THIS YOUR FAX FOR EMPLOYERS, fax
Need a fax number to send in my written notice, fax
WHAT IS YOUR FAX, fax
FAX NUMBER, fax
fax number, fax
Looking for a local fax number in Greenville ms, fax
What is the fax number, fax
What is the fax number for employer information request forms?, fax
what's the fax number for Hernando ms, fax
I am an employer trying to fax Child Support data that was requested and the number on the fax PHONE_NUMBER is not working.  Is there another number I can use?, fax
Fax # please, fax
can you give me the fax to where to send medical support form, fax
need fax number, fax
i need a fax number to send in forms, fax
Fax number, fax
I just need the Email or Fax Number to send you the letter., fax
may I have the fax number to submit a change of address, fax
fax, fax
is there a fax number to send information to, fax